{
  "schema": "kel-graph-change-request/0.1",
  "change_request_id": "kel:change:q2_option_layout:header_valve_requires_gd_sb",
  "status": "implemented",
  "created_utc": "2026-09-14T16:40:31Z",
  "linked_experience_id": "kel:experience:paper01a_case02_option2:20260915",
  "linked_feedback_id": "kel:feedback:q2_option_layout:header_valve_requires_gd_sb",
  "target_layer": "EDAS",
  "change_type": "new_assembly_constraint",
  "problem_observed": "A header valve was emitted without a compulsory GD-SB base structure.",
  "proposed_change": "Require canonical GD-SB geometry when a header valve or other non-roller-contact header component is present.",
  "evidence_requirement": "Focused regression tests and repository implementation demonstrating the gate or report behavior.",
  "priority": "high",
  "expert_review_ref": {
    "id": "kel:review:session:20260915_pending_candidate_implementation",
    "repo_path": null
  },
  "implementation_ref": {
    "target": "tools/design_rules_v02.py; plotters/ils_builder.py",
    "repo_path": "tools/design_rules_v02.py",
    "notes": "Implemented from Q2 candidate feedback in this update."
  }
}
