{
  "schema": "kel-graph-change-request/0.1",
  "change_request_id": "kel:change:q2_option_layout:connection_labels_legible",
  "status": "implemented",
  "created_utc": "2026-09-14T16:40:31Z",
  "linked_experience_id": "kel:experience:paper01a_case02_option2:20260915",
  "linked_feedback_id": "kel:feedback:q2_option_layout:connection_labels_legible",
  "target_layer": "Plotters",
  "change_type": "new_plotting_rule",
  "problem_observed": "GD-ST-to-header and GD-ST-to-branch connection types were absent or too small in plots.",
  "proposed_change": "Render declared connection-type labels and expose them in plot reports with a minimum readable font.",
  "evidence_requirement": "Focused regression tests and repository implementation demonstrating the gate or report behavior.",
  "priority": "high",
  "expert_review_ref": {
    "id": "kel:review:session:20260915_pending_candidate_implementation",
    "repo_path": null
  },
  "implementation_ref": {
    "target": "plotters/ils_plotter.py; tools/_plot_cli.py; plotters/config/plot_style.yaml",
    "repo_path": "plotters/ils_plotter.py",
    "notes": "Implemented from Q2 candidate feedback in this update."
  }
}
