{
  "schema": "kel-graph-change-request/0.1",
  "change_request_id": "kel:change:q1_ilt_layout:piping_connections_scope",
  "status": "implemented",
  "created_utc": "2026-09-13T09:20:15Z",
  "linked_experience_id": "kel:experience:edpr:q1_ilt_header_valve_branch_vertical_connector_001:20260913083159",
  "linked_feedback_id": "kel:feedback:q1_ilt_layout:piping_connections_scope",
  "target_layer": "KEL",
  "change_type": "new_output_policy",
  "problem_observed": "Connections mentioned here are all piping connections.",
  "proposed_change": "Review and implement APF action `add_or_update_kel_output_presentation_policy` for observed issue: Connections mentioned here are all piping connections.",
  "evidence_requirement": "Provide before/after answer examples showing the required presentation rule and validate that KEL feedback trace remains linked.",
  "priority": "medium",
  "expert_review_ref": {
    "id": "kel:review:session:20260915_pending_candidate_implementation",
    "repo_path": null
  },
  "implementation_ref": {
    "target": "tools/design_rules_v02.py; tools/solution_to_layout.py; plotters/ils_builder.py; plotters/ils_plotter.py; tools/_plot_cli.py; knowledge/edpr/EDPR_PARSER_PROMPT_RUNTIME.md",
    "repo_path": "tools/design_rules_v02.py",
    "notes": "Implemented as deterministic EDPR confirmation, branch anchoring, valve/GD-SB, plot/report exposure, label legibility, and typed-gap gates."
  }
}
