{
  "schema": "kel-graph-change-request/0.1",
  "change_request_id": "kel:change:q1_ilt_layout:valve_easb_default",
  "status": "pending",
  "created_utc": "2026-09-13T09:20:15Z",
  "linked_experience_id": "kel:experience:edpr:q1_ilt_header_valve_branch_vertical_connector_001:20260913083159",
  "linked_feedback_id": "kel:feedback:q1_ilt_layout:valve_easb_default",
  "target_layer": "EDAS",
  "change_type": "new_assembly_constraint",
  "problem_observed": "There is valve on header line, but no EA-SB was added. Record default condition for valves that they cannot ride the rollers as well as take their contact loads. So it needs protection. Mention this assumption.",
  "proposed_change": "Add a reusable assembly rule that inline valves needing roller/contact-load protection should trigger EA-SB protection or an explicit unresolved design assumption.",
  "evidence_requirement": "Provide an EDAS layout example, successful build_ils validation, declared associations, and plotter output demonstrating the rule.",
  "priority": "high",
  "expert_review_ref": null
}
