{
  "schema": "kel-graph-change-request/0.1",
  "change_request_id": "kel:change:q2_option_layout:edpr_confirmation_before_design",
  "status": "implemented",
  "created_utc": "2026-09-14T16:40:31Z",
  "linked_experience_id": "kel:experience:paper01a_case02_option2:20260915",
  "linked_feedback_id": "kel:feedback:q2_option_layout:edpr_confirmation_before_design",
  "target_layer": "EDPR",
  "change_type": "new_workflow_gate",
  "problem_observed": "The LLM proceeded to concept generation without first emitting EDPR/problem understanding for user review.",
  "proposed_change": "Require EDPR/problem understanding confirmation before design generation or layout emission.",
  "evidence_requirement": "Focused regression tests and repository implementation demonstrating the gate or report behavior.",
  "priority": "high",
  "expert_review_ref": {
    "id": "kel:review:session:20260915_pending_candidate_implementation",
    "repo_path": null
  },
  "implementation_ref": {
    "target": "tools/design_rules_v02.py; knowledge/edpr/EDPR_PARSER_PROMPT_RUNTIME.md",
    "repo_path": "tools/design_rules_v02.py",
    "notes": "Implemented from Q2 candidate feedback in this update."
  }
}
