{
  "schema": "kel-graph-change-request/0.1",
  "change_request_id": "kel:change:q1_ilt_layout:east_connections_labelled",
  "status": "pending",
  "created_utc": "2026-09-13T09:20:15Z",
  "linked_experience_id": "kel:experience:edpr:q1_ilt_header_valve_branch_vertical_connector_001:20260913083159",
  "linked_feedback_id": "kel:feedback:q1_ilt_layout:east_connections_labelled",
  "target_layer": "EDAS",
  "change_type": "new_assembly_constraint",
  "problem_observed": "EA-ST to pipeline connections need to be labelled and plotted.",
  "proposed_change": "Add or strengthen EDAS/plotter requirements to show GD-ST parameters, active connector slots, branch-to-top/side association, and pipe-side connection points.",
  "evidence_requirement": "Provide an EDAS layout example, successful build_ils validation, declared associations, and plotter output demonstrating the rule.",
  "priority": "high",
  "expert_review_ref": null
}
