{
  "schema": "kel-graph-change-request/0.1",
  "change_request_id": "kel:change:q1_ilt_layout:branch_direction",
  "status": "pending",
  "created_utc": "2026-09-13T09:20:15Z",
  "linked_experience_id": "kel:experience:edpr:q1_ilt_header_valve_branch_vertical_connector_001:20260913083159",
  "linked_feedback_id": "kel:feedback:q1_ilt_layout:branch_direction",
  "target_layer": "Plotters",
  "change_type": "new_plotting_rule",
  "problem_observed": "Plot has branch line located below the pipeline. It should be upwards.",
  "proposed_change": "Review and implement APF action `correct_plot_geometry_labels_or_scale_and_add_regression_case` for observed issue: Plot has branch line located below the pipeline. It should be upwards.",
  "evidence_requirement": "Provide before/after plot output, plot report, and regression coverage for labels, scale, and represented connections.",
  "priority": "high",
  "expert_review_ref": null
}
