{
  "schema": "kel-graph-change-request/0.1",
  "change_request_id": "kel:change:q1_ilt_layout:branch_connector_east_default",
  "status": "implemented",
  "created_utc": "2026-09-13T09:20:15Z",
  "linked_experience_id": "kel:experience:edpr:q1_ilt_header_valve_branch_vertical_connector_001:20260913083159",
  "linked_feedback_id": "kel:feedback:q1_ilt_layout:branch_connector_east_default",
  "target_layer": "EDAS",
  "change_type": "new_assembly_constraint",
  "problem_observed": "Branch connector always needs to be associated to an EA-ST. Note this in default assumption.",
  "proposed_change": "Add or strengthen EDAS/plotter requirements to show GD-ST parameters, active connector slots, branch-to-top/side association, and pipe-side connection points.",
  "evidence_requirement": "Provide an EDAS layout example, successful build_ils validation, declared associations, and plotter output demonstrating the rule.",
  "priority": "high",
  "expert_review_ref": {
    "id": "kel:review:session:20260915_pending_candidate_implementation",
    "repo_path": null
  },
  "implementation_ref": {
    "target": "tools/design_rules_v02.py; tools/solution_to_layout.py; plotters/ils_builder.py; plotters/ils_plotter.py; tools/_plot_cli.py; knowledge/edpr/EDPR_PARSER_PROMPT_RUNTIME.md",
    "repo_path": "tools/design_rules_v02.py",
    "notes": "Implemented as deterministic EDPR confirmation, branch anchoring, valve/GD-SB, plot/report exposure, label legibility, and typed-gap gates."
  }
}
