{
  "schema": "kel-graph-change-request/0.1",
  "change_request_id": "kel:change:q1_ilt_layout:plot_scale",
  "status": "implemented",
  "created_utc": "2026-09-13T09:20:15Z",
  "linked_experience_id": "kel:experience:edpr:q1_ilt_header_valve_branch_vertical_connector_001:20260913083159",
  "linked_feedback_id": "kel:feedback:q1_ilt_layout:plot_scale",
  "target_layer": "Plotters",
  "change_type": "new_plotting_rule",
  "problem_observed": "Plot scale is too small or the picture cannot be zoomed in.",
  "proposed_change": "Review and implement APF action `correct_plot_geometry_labels_or_scale_and_add_regression_case` for observed issue: Plot scale is too small or the picture cannot be zoomed in.",
  "evidence_requirement": "Provide before/after plot output, plot report, and regression coverage for labels, scale, and represented connections.",
  "priority": "high",
  "expert_review_ref": {
    "id": "kel:review:session:20260915_pending_candidate_implementation",
    "repo_path": null
  },
  "implementation_ref": {
    "target": "tools/design_rules_v02.py; tools/solution_to_layout.py; plotters/ils_builder.py; plotters/ils_plotter.py; tools/_plot_cli.py; knowledge/edpr/EDPR_PARSER_PROMPT_RUNTIME.md",
    "repo_path": "tools/design_rules_v02.py",
    "notes": "Implemented as deterministic EDPR confirmation, branch anchoring, valve/GD-SB, plot/report exposure, label legibility, and typed-gap gates."
  }
}
