{
  "schema": "kel-graph-change-request/0.1",
  "change_request_id": "kel:change:q1_ilt_layout:easb_shape_from_edes",
  "status": "pending",
  "created_utc": "2026-09-13T09:20:15Z",
  "linked_experience_id": "kel:experience:edpr:q1_ilt_header_valve_branch_vertical_connector_001:20260913083159",
  "linked_feedback_id": "kel:feedback:q1_ilt_layout:easb_shape_from_edes",
  "target_layer": "EDAS",
  "change_type": "new_assembly_constraint",
  "problem_observed": "EA-SB shape is not correct. It must follow EDES GD-SB knowledge and its parameters, not a generic rectangular protection frame.",
  "proposed_change": "Add or strengthen EDES/plotter requirements so GD-SB is drawn from EDES parameters rather than a generic protection-frame symbol.",
  "evidence_requirement": "Provide an EDAS layout example, successful build_ils validation, declared associations, and plotter output demonstrating the rule.",
  "priority": "high",
  "expert_review_ref": null
}
